{
  "schema": 1,
  "status": "pending",
  "disc_name": "Sword Art Online 2 Part 2",
  "series": { "title": "Sword Art Online", "year": 2012, "tvdb": 259640 },
  "disc": 2,
  "release": { "name": "Sword Art Online II Part 2", "publisher": "Anime Limited", "region": "B", "format": "dvd" },
  "titles": {
    "0": "S02E08",
    "1": "S02E09",
    "2": "S02E10",
    "3": "S02E11",
    "4": "S02E12",
    "5": "S02E13",
    "6": "S02E14",
    "7": "S00E12"
  },
  "source": "Read off the disc by its owner. Title 7 is episode 14.5, \"Debriefing\", which TVDB files as S00E12."
}
